### ISSUE TITLE
BGP: advertised routes are being double-sent

### ISSUE THREAD

**Issue by taspelund** [oxidecomputer/maghemite#403]
While testing other maghemite changes, I noticed via pcap on cEOS that mgd is double-sending advertised routes.
After resetting the session on the Arista side, you can see that the same NLRI is appearing in the Update message twice -- both times with identical Path Attributes:
```
00:47:29.717561 a8:40:25:77:5e:84 > 02:42:ac:14:00:02, ethertype IPv4 (0x0800), length 160: (tos 0x0, ttl 64, id 9797, offset 0, flags [DF], proto TCP (6), length 146)
    198.51.101.14.40886 > 198.51.101.13.bgp: Flags [P.], seq 90:184, ack 193, win 62535, options [nop,nop,TS val 10272612 ecr 2476675177], length 94: BGP
        Update Message (2), length: 47
          Origin (1), length: 1, Flags [T]: IGP
            0x0000:  00
          AS Path (2), length: 6, Flags [T]: 48
            0x0000:  0201 0000 0030
          Next Hop (3), length: 4, Flags [T]: 198.51.101.14
            0x0000:  c633 650e
          Updated routes:
            198.51.100.0/24         <<<<<<
        Update Message (2), length: 47
          Origin (1), length: 1, Flags [T]: IGP
            0x0000:  00
          AS Path (2), length: 6, Flags [T]: 48
            0x0000:  0201 0000 0030
          Next Hop (3), length: 4, Flags [T]: 198.51.101.14
            0x0000:  c633 650e
          Updated routes:
            198.51.100.0/24         <<<<<<
```

In a different test / different build of maghemite (although same a4x2 testbed), I noticed this happening when sending originated routes upon a SoftOutbound clear (mgd is `198.51.101.2`):
```
00:39:29.728623 02:42:ac:13:00:02 > a8:40:25:4c:67:29, ethertype IPv4 (0x0800), length 117: (tos 0xc0, ttl 1, id 54612, offset 0, flags [DF], proto TCP (6), length 103)
    198.51.101.1.bgp > 198.51.101.2.32859: Flags [P.], seq 75:126, ack 71, win 509, options [nop,nop,TS val 2579831976 ecr 9792565], length 51: BGP
        Update Message (2), length: 51
          Origin (1), length: 1, Flags [T]: IGP
            0x0000:  00
          AS Path (2), length: 10, Flags [T]: 50 48
            0x0000:  0202 0000 0032 0000 0030
          Next Hop (3), length: 4, Flags [T]: 198.51.101.1
            0x0000:  c633 6501
          Updated routes:
            198.51.100.0/24
00:39:29.728654 a8:40:25:4c:67:29 > 02:42:ac:13:00:02, ethertype IPv4 (0x0800), length 132: (tos 0x0, ttl 64, id 11129, offset 0, flags [DF], proto TCP (6), length 118)
    198.51.101.2.32859 > 198.51.101.1.bgp: Flags [P.], seq 71:137, ack 75, win 62535, options [nop,nop,TS val 9792565 ecr 2579831976], length 66: BGP
        Keepalive Message (4), length: 19
        Update Message (2), length: 47
          Origin (1), length: 1, Flags [T]: IGP
            0x0000:  00
          AS Path (2), length: 6, Flags [T]: 47
            0x0000:  0201 0000 002f
          Next Hop (3), length: 4, Flags [T]: 198.51.101.2
            0x0000:  c633 6502
          Updated routes:
            198.51.100.0/24         <<<<<<
00:39:29.728660 02:42:ac:13:00:02 > a8:40:25:4c:67:29, ethertype IPv4 (0x0800), length 66: (tos 0xc0, ttl 1, id 54613, offset 0, flags [DF], proto TCP (6), length 52)
    198.51.101.1.bgp > 198.51.101.2.32859: Flags [.], seq 126, ack 137, win 509, options [nop,nop,TS val 2579831976 ecr 9792565], length 0
00:39:29.728981 a8:40:25:4c:67:29 > 02:42:ac:13:00:02, ethertype IPv4 (0x0800), length 113: (tos 0x0, ttl 64, id 11130, offset 0, flags [DF], proto TCP (6), length 99)
    198.51.101.2.32859 > 198.51.101.1.bgp: Flags [P.], seq 137:184, ack 126, win 62535, options [nop,nop,TS val 9792566 ecr 2579831976], length 47: BGP
        Update Message (2), length: 47
          Origin (1), length: 1, Flags [T]: IGP
            0x0000:  00
          AS Path (2), length: 6, Flags [T]: 47
            0x0000:  0201 0000 002f
          Next Hop (3), length: 4, Flags [T]: 198.51.101.2
            0x0000:  c633 6502
          Updated routes:
            198.51.100.0/24         <<<<<<
00:39:29.728993 02:42:ac:13:00:02 > a8:40:25:4c:67:29, ethertype IPv4 (0x0800), length 133: (tos 0xc0, ttl 1, id 54614, offset 0, flags [DF], proto TCP (6), length 119)
    198.51.101.1.bgp > 198.51.101.2.32859: Flags [P.], seq 126:193, ack 184, win 509, options [nop,nop,TS val 2579831977 ecr 9792566], length 67: BGP
        Update Message (2), length: 48
          Origin (1), length: 1, Flags [T]: IGP
            0x0000:  00
          AS Path (2), length: 10, Flags [T]: 50 52
            0x0000:  0202 0000 0032 0000 0034
          Next Hop (3), length: 4, Flags [T]: 198.51.101.1
            0x0000:  c633 6501
          Updated routes:
            0.0.0.0/0
        Keepalive Message (4), length: 19
```

So this is happening both when triggering an outbound Update for a pre-existing established peer, and when sending out the initial Update for a newly established peer.

**Comment by taspelund** [comment]
After doing some initial code-diving, my initial theory is that we're calling send_all() in places where we should only be calling send_update.

Example on line 1262:
```
   1228     fn session_setup(&self, pc: PeerConnection<Cnx>) -> FsmState<Cnx> {
   1229         // Collect the prefixes this router is originating.
   1230         let originated = match self.db.get_origin4() {
   1231             Ok(value) => value,
   1232             Err(e) => {
   1233                 //TODO possible death loop. Should we just panic here?
   1234                 err!(self; "failed to get originated from db: {e}");
   1235                 return FsmState::SessionSetup(pc);
   1236             }
   1237         };
   1238
   1239         // Ensure the router has a fanout entry for this peer.
   1240         let mut fanout = write_lock!(self.fanout);
   1241         fanout.add_egress(
   1242             self.neighbor.host.ip(),
   1243             crate::fanout::Egress {
   1244                 event_tx: Some(self.event_tx.clone()),
   1245                 log: self.log.clone(),
   1246             },
   1247         );
   1248         drop(fanout);
   1249
   1250         self.send_keepalive(&pc.conn);
   1251
   1252         // Send an update to our peer with the prefixes this router is
   1253         // originating.
   1254         if !originated.is_empty() {
   1255             let mut update = UpdateMessage {
   1256                 path_attributes: self.router.base_attributes(),
   1257                 ..Default::default()
   1258             };
   1259             for p in originated {
   1260                 update.nlri.push(p.into());
   1261             }
   1262             read_lock!(self.fanout).send_all(&update);
   1263             if let Err(e) =
   1264                 self.send_update(update, &pc.conn, ShaperApplication::Current)
   1265             {
   1266                 err!(self; "sending update to peer failed {e}");
   1267                 return self.exit_established(pc);
   1268             }
   1269         }
   1270
   1271         // Transition to the established state.
   1272         FsmState::Established(pc)
   1273     }
```

**Comment by taspelund** [comment]
The only two places I'm seeing the extra call of `send_all()` are in `session_setup()` and `handle_refresh()`, which seems accurate given what I've observed so far.  Will start working on a fix.
